text,label,label_text,global_label,task_id
what timezone is canada in,66,timezone,123,1
whats the timezone for modesto,66,timezone,123,1
what timezone is chicago in,66,timezone,123,1
can you tell me the timezone that hartford is in,66,timezone,123,1
what timezone do they use in la,66,timezone,123,1
can you tell me what timezone chicago is in,66,timezone,123,1
can you tell me the timezone in san francisco,66,timezone,123,1
what's the timezone for brasilia,66,timezone,123,1
what's the timezone for london,66,timezone,123,1
what timezone is russia in,66,timezone,123,1
what timezone is melbourne in,66,timezone,123,1
does the central timezone include austin,66,timezone,123,1
in which timezone is jamaica,66,timezone,123,1
can you tell my what france's timezone is,66,timezone,123,1
can you kindly clear my agenda list,65,todo_list_update,127,1
please erase everything on my to do list,65,todo_list_update,127,1
i need to add the chore of vacuuming to my task list,65,todo_list_update,127,1
delete my to do list,65,todo_list_update,127,1
cleaning needs to be on my to do list,65,todo_list_update,127,1
nix folding laundry from my todo list,65,todo_list_update,127,1
please include feeding the fish on my to do list,65,todo_list_update,127,1
i need to include a stop at the pharmacy to the list of things to do,65,todo_list_update,127,1
on my big project task list please add paint shutters in spring,65,todo_list_update,127,1
remove all items from todo list,65,todo_list_update,127,1
please add cleaning on my list to do,65,todo_list_update,127,1
can you place laundry on my to do list,65,todo_list_update,127,1
i need to add dusting the bookshelf to my to do list,65,todo_list_update,127,1
please add watering the plants to my current to do list,65,todo_list_update,127,1
please be sure to put folding laundry on my to do list for me,65,todo_list_update,127,1
i want you to clear out my to do list,65,todo_list_update,127,1
add dishes to my list,65,todo_list_update,127,1
throw mopping onto my to do list,65,todo_list_update,127,1
can you check washing the dishes off on my to do list,65,todo_list_update,127,1
clear out my entire todo list,65,todo_list_update,127,1
is there any traffic on my way to work,24,traffic,128,1
is the traffic bad on the way to work,24,traffic,128,1
is there any traffic congestion on my way to the closest whole foods,24,traffic,128,1
is there traffic to work,24,traffic,128,1
is traffic heavy on my route to washington,24,traffic,128,1
"tell me about traffic conditions in ocean city, nj on sunday mornings around 10 am in the summer",24,traffic,128,1
how much traffic is there before the stadium,24,traffic,128,1
i gotta know what the traffic is like on the way to phoenix,24,traffic,128,1
i need to know what the traffic typically like at 3:30 on the route to phoenix,24,traffic,128,1
how is the traffic on my way to the venue,24,traffic,128,1
how will traffic be at 7am on the way to my job,24,traffic,128,1
how's highway traffic today,24,traffic,128,1
what's the traffic at lexington,24,traffic,128,1
is there traffic on my way to work today,24,traffic,128,1
how is the traffic near lexington,24,traffic,128,1
what's the traffic like on the way to patterson,24,traffic,128,1
traffic looking alright going towards burger king,24,traffic,128,1
what is the traffic situation at the olive garden restaurant,24,traffic,128,1
let me know the traffic in tempe,24,traffic,128,1
how bad is city traffic in miami on friday's at 5 pm,24,traffic,128,1
please transfer $50 to my checking account from credit,133,transfer,130,0
send fifty dollars from me to carrie,133,transfer,130,0
move 57 dollars from saving into mom,133,transfer,130,0
take $40 and transfer it to account a from b,133,transfer,130,0
i would like to transfer from one account to my second one,133,transfer,130,0
send over 50 dollars between my shared and not shared accounts,133,transfer,130,0
make a transfer of $200 from my savings account to my checking account,133,transfer,130,0
i need my money to be moved,133,transfer,130,0
transfer money to another account,133,transfer,130,0
please transfer $100 from my checking to my savings account,133,transfer,130,0
please transfer $s from saving to checking,133,transfer,130,0
send ten dollars from bank of america to capital one,133,transfer,130,0
move $40 from account b to account a,133,transfer,130,0
can you transfer $5 from savings to checking,133,transfer,130,0
send $100 from paypal to my bank,133,transfer,130,0
transfer 200 dollars from paypal to savings,133,transfer,130,0
please switch $s checking to mortage,133,transfer,130,0
i got to transfer ten dollars from my bank of america account to my capital one account,133,transfer,130,0
please transfer $250 from checking to savings,133,transfer,130,0
put a hundred dollars in my ally account from bluebird,133,transfer,130,0
i would i say subway if i were english,61,translate,131,1
tell me how the russians say notebook,61,translate,131,1
what expression would i use to say i love you if i were an italian,61,translate,131,1
translate english to french hello,61,translate,131,1
how do you say it's snowing in german,61,translate,131,1
how do you say i'm hungry in french,61,translate,131,1
translate hello in french,61,translate,131,1
how do they say goodbye in hawaii,61,translate,131,1
translate hello to french,61,translate,131,1
"how do they say ""i love you"" in japanese",61,translate,131,1
how would you say can i borrow five dollars in portuguese,61,translate,131,1
can you translate good bye into russian for me,61,translate,131,1
how would i say love in french,61,translate,131,1
how do i say you're welcome in chinese,61,translate,131,1
please translate grocery into french for me,61,translate,131,1
how would i say if i were english subway,61,translate,131,1
what is spanish for good morning,61,translate,131,1
can you translate bat into russian for me,61,translate,131,1
what is latin for i love you,61,translate,131,1
how do you say thank you in german,61,translate,131,1
is there a travel alert for north korea,128,travel_alert,132,1
i am going to australia and want to be notified of any travel alerts,128,travel_alert,132,1
does ireland have any travel alerts i should be aware of,128,travel_alert,132,1
can traveling to nepal be safe (what's safe in x),128,travel_alert,132,1
can you list the places that there are travel alerts for,128,travel_alert,132,1
any travel alerts for canada,128,travel_alert,132,1
is it safe to travel to norway,128,travel_alert,132,1
how safe is it to travel to mongolia (how safe is mongolia),128,travel_alert,132,1
list of countries with travel alerts,128,travel_alert,132,1
is it safe to fly to russia,128,travel_alert,132,1
where are there current travel alerts,128,travel_alert,132,1
does the country have a travel alert,128,travel_alert,132,1
any travel advisories for portugal,128,travel_alert,132,1
what travel alerts are there in china,128,travel_alert,132,1
does france have any current travel alerts,128,travel_alert,132,1
does finland have any travel alerts i should be aware of,128,travel_alert,132,1
what are today's travel advisories,128,travel_alert,132,1
is there a travel alert for that country,128,travel_alert,132,1
what alerts are listed for traveling to paris,128,travel_alert,132,1
look for travel alerts for china,128,travel_alert,132,1
i'm traveling to england soon and want to inform my bank,146,travel_notification,133,0
inform my bank that i will be in rome from february 1 to march 1,146,travel_notification,133,0
notify my bank that i will be in rome from february 1 to march 1,146,travel_notification,133,0
tell my bank i am traveling out of country,146,travel_notification,133,0
i need to let my bank know i am traveling to chicago,146,travel_notification,133,0
please tell my bank i will be in israel from the 6th to the 23rd,146,travel_notification,133,0
i'm traveling to paris soon and want to inform my bank,146,travel_notification,133,0
"i'm going to paris soon and want to let my bank know, how do i do that",146,travel_notification,133,0
i'm travelling to thailand soon and want to inform my bank,146,travel_notification,133,0
i'm traveling to ca soon and want to inform my bank,146,travel_notification,133,0
let me bank know i will be in brazil from june 1st to july 1st,146,travel_notification,133,0
"let my bank know that i'll be in moscow, russia",146,travel_notification,133,0
notify my bank i am travailing from denver to la,146,travel_notification,133,0
can you let my bank know i'll be in uruguay from january to august,146,travel_notification,133,0
i've told my financial institution that i'm in africa from august 6 to december 5,146,travel_notification,133,0
i've notified my bank that i'm in mexico from august 1 to august 5,146,travel_notification,133,0
inform my bank i will travel to brazil from june 1st to july 1st,146,travel_notification,133,0
i'm going out of the country and need to notify my bank,146,travel_notification,133,0
i'm traveling to fresnosoon and want to inform my bank,146,travel_notification,133,0
tell the bank i will be traveling internationally soon,146,travel_notification,133,0
what kinds of fun touristy things are there to do in boston,149,travel_suggestion,134,0
where should i travel to next,149,travel_suggestion,134,0
what are some good restaurants in chicago,149,travel_suggestion,134,0
"if i go to evans, what should i do",149,travel_suggestion,134,0
where should i book my next trip,149,travel_suggestion,134,0
what are some fun things to do in sweden,149,travel_suggestion,134,0
what's the best place to just get away from it all,149,travel_suggestion,134,0
tell me things i can do in chicago,149,travel_suggestion,134,0
what are some things i can do in portland,149,travel_suggestion,134,0
"in austin, what are some tourist things to do",149,travel_suggestion,134,0
"what do you suggest for entertainment in tampa, florida",149,travel_suggestion,134,0
where should i spend my time off,149,travel_suggestion,134,0
what can i do in new orleans for fun,149,travel_suggestion,134,0
"is there anything fun to do in manassas, virginia",149,travel_suggestion,134,0
what things are there to do in kentucky,149,travel_suggestion,134,0
what experiences does kentucky offer,149,travel_suggestion,134,0
give me some ideas on what i can do in seattle for fun,149,travel_suggestion,134,0
what are the main attractions in gatlinburg,149,travel_suggestion,134,0
what are some tourist sites to see in ann arbor,149,travel_suggestion,134,0
is there anything neat to do in boston,149,travel_suggestion,134,0
favorite what's currently playing on my playlist,141,update_playlist,136,1
i gotta add hey jude by the beatles to my playlist,141,update_playlist,136,1
insert what i am listening to into my jazz playlist,141,update_playlist,136,1
put dr feelgood by motley crue on my playlist,141,update_playlist,136,1
add welcome to the jungle by guns n roses to my playlist,141,update_playlist,136,1
please add this song to my alternative playlist,141,update_playlist,136,1
put the current song in my favorite playlist,141,update_playlist,136,1
add this song to my rainy day playlist,141,update_playlist,136,1
"put mambo #5 by lou bega on my playlist, please",141,update_playlist,136,1
add body to my dance playlist,141,update_playlist,136,1
will you add what i'm listening to to my bedroom playlist,141,update_playlist,136,1
"i want this song put on my ""kids"" playlist",141,update_playlist,136,1
i need to add this song to my playlist of rock,141,update_playlist,136,1
god's plan will be added to my new playlist,141,update_playlist,136,1
i wanna add help! by the beatles to my playlist,141,update_playlist,136,1
will you please add cannons by phil wickham to my playlist,141,update_playlist,136,1
will you add what i'm listening to to my work playlist,141,update_playlist,136,1
transfer happy to my rb playlist,141,update_playlist,136,1
god's plan will be my new song added to new playlist,141,update_playlist,136,1
add single ladies by beyonce to my pop playlist,141,update_playlist,136,1
what sorts of hobbies do you enjoy,15,what_are_your_hobbies,141,0
how do you spend your spare time,15,what_are_your_hobbies,141,0
is there anything you like to do in your free time,15,what_are_your_hobbies,141,0
what are ai's hobbies,15,what_are_your_hobbies,141,0
what are you hobbies,15,what_are_your_hobbies,141,0
what are some of the hobbies you enjoy doing,15,what_are_your_hobbies,141,0
please tell me your hobbies,15,what_are_your_hobbies,141,0
what things do you do for fun,15,what_are_your_hobbies,141,0
what kind of hobbies do you have,15,what_are_your_hobbies,141,0
what things do you enjoy doing,15,what_are_your_hobbies,141,0
what makes you happy in your free time,15,what_are_your_hobbies,141,0
what kind of things do you do when you have free time,15,what_are_your_hobbies,141,0
i'd like to know your hobbies,15,what_are_your_hobbies,141,0
might you have any hobbies,15,what_are_your_hobbies,141,0
what hobbies do you like doing,15,what_are_your_hobbies,141,0
do you have anything you enjoy to do,15,what_are_your_hobbies,141,0
what keeps you busy in your free time,15,what_are_your_hobbies,141,0
so what sort of hobbies are you into,15,what_are_your_hobbies,141,0
tell me all about your hobbies,15,what_are_your_hobbies,141,0
what do you do in your free time,15,what_are_your_hobbies,141,0
