text,label,label_text,global_label,task_id
"i can't remember when my car last went to the shop, can you find out for me",37,last_maintenance,63,0
when did i last service my car with an oil change,37,last_maintenance,63,0
how long has it been since my car was last in the shop,37,last_maintenance,63,0
what was the date of my last auto appointment,37,last_maintenance,63,0
i need to know when it was that i last took my car to have the oil changed,37,last_maintenance,63,0
when did i take my car to paul's auto last,37,last_maintenance,63,0
find out how long it has been since my car was last in the shop,37,last_maintenance,63,0
"search and tell me when my most recent oil change happened, please",37,last_maintenance,63,0
when did i last have my vehicle checked on,37,last_maintenance,63,0
check my calendar for the date that my care was last serviced,37,last_maintenance,63,0
how long has it been since my car was in the shop,37,last_maintenance,63,0
when was the last time my car was in the shop,37,last_maintenance,63,0
tell me when someone looked at my car last,37,last_maintenance,63,0
my luggage was lost on the flight,113,lost_luggage,64,3
what if i lost my luggage,113,lost_luggage,64,3
locate lost luggage from flight america airlines in o'hare,113,lost_luggage,64,3
"if i lost my luggage, where can i get help",113,lost_luggage,64,3
i miss placed my luggage i was on delta flight ab123 out of new york,113,lost_luggage,64,3
"i need my luggage found, i was on delta flight ab123 out of san francisco",113,lost_luggage,64,3
my luggage has not arrived and i would like help locating it,113,lost_luggage,64,3
"my luggage is missing, i think",113,lost_luggage,64,3
"my luggage is nowhere in sight, it might be lost",113,lost_luggage,64,3
how do i go about resolving my luggage that didn't arrive,113,lost_luggage,64,3
my luggage is lost i was on delta flight ab123 out of new york,113,lost_luggage,64,3
do you know where the luggage for people on panam flight ab123 out of tuscon is,113,lost_luggage,64,3
my luggage is missing i was on american airlines flight ab123 out of dallas,113,lost_luggage,64,3
what is the best way to deal with my lost luggage,113,lost_luggage,64,3
i flew on southwest airlines flight ab123 out of dallas and i can not find my luggage,113,lost_luggage,64,3
my luggage is lost and i would like help trying to locate it,113,lost_luggage,64,3
i was on delta flight ab123 out of new york and i can't find my luggage,113,lost_luggage,64,3
i need to figure out what to do about lost luggage,113,lost_luggage,64,3
how to find lost luggage,113,lost_luggage,64,3
do you know whom i should contact since my luggage did not arrive,113,lost_luggage,64,3
would you give jenny a call,25,make_call,65,0
can you call robby,25,make_call,65,0
place a call to bill now,25,make_call,65,0
i want to talk to sarah,25,make_call,65,0
can you call mom,25,make_call,65,0
can you call russell,25,make_call,65,0
call dave,25,make_call,65,0
get a hold of sue,25,make_call,65,0
i am going to call the landlord,25,make_call,65,0
i must call roderick,25,make_call,65,0
phone sarah,25,make_call,65,0
please call christy,25,make_call,65,0
i want to make a call to uncle,25,make_call,65,0
it's time for me to call drew,25,make_call,65,0
connect me to bob,25,make_call,65,0
call home,25,make_call,65,0
please make a phone call to christopher,25,make_call,65,0
call my mother,25,make_call,65,0
use my phone to dial work,25,make_call,65,0
dial x's phone please,25,make_call,65,0
that could maybe be it,121,maybe,66,2
i don't know how to answer to that,121,maybe,66,2
"maybe yes, maybe no",121,maybe,66,2
not a clue,121,maybe,66,2
"maybe, maybe not",121,maybe,66,2
i can't answer yes or no right now,121,maybe,66,2
i really don't know,121,maybe,66,2
i don't have that information,121,maybe,66,2
i have no knowledge of that,121,maybe,66,2
both maybe,121,maybe,66,2
i'm not sure which it is,121,maybe,66,2
i am not to sure about that,121,maybe,66,2
it could be either,121,maybe,66,2
i'm not sure which one because it could be either of them,121,maybe,66,2
im not sure,121,maybe,66,2
cant say,121,maybe,66,2
"no idea, sorry",121,maybe,66,2
i will know later,121,maybe,66,2
i am not confident on that,121,maybe,66,2
that answer's above my pay scale,121,maybe,66,2
i want an italian meal suggestion,46,meal_suggestion,67,2
got any good dinner ideas,46,meal_suggestion,67,2
what can i make for dinner using ground beef,46,meal_suggestion,67,2
can you give me a burmese dinner suggestion,46,meal_suggestion,67,2
may you suggest a meal from italy to me,46,meal_suggestion,67,2
do you have any suggestions for a meal from australia,46,meal_suggestion,67,2
what's the pizza like around here,46,meal_suggestion,67,2
i'd like an italian meal suggestion,46,meal_suggestion,67,2
can you recommend for me a dish from ethiopia,46,meal_suggestion,67,2
what would you suggest for dinner,46,meal_suggestion,67,2
i need a suggestion for a dinner recipe,46,meal_suggestion,67,2
would you provide me with italian cuisine dinner suggestions,46,meal_suggestion,67,2
can you give me a thai dinner suggestion,46,meal_suggestion,67,2
suggest an italian meal to me,46,meal_suggestion,67,2
which mexican meal would be good,46,meal_suggestion,67,2
help me decide what mexican meal i want,46,meal_suggestion,67,2
suggest a meal from italy to me,46,meal_suggestion,67,2
what would be good for dinner,46,meal_suggestion,67,2
what's the best pizza place around here,46,meal_suggestion,67,2
what peruvian dish should i make,46,meal_suggestion,67,2
what is 10 ounces in grams,31,measurement_conversion,69,3
how do you convert milliliters to ounces,31,measurement_conversion,69,3
how many centimeters are in an inch,31,measurement_conversion,69,3
what would be the conversion between tablespoons and teaspoons,31,measurement_conversion,69,3
how many cups make a gallon,31,measurement_conversion,69,3
convert cm to inch,31,measurement_conversion,69,3
how many kilos are in 100 pounds,31,measurement_conversion,69,3
help me to understand the conversion between tablespoons and teaspoons,31,measurement_conversion,69,3
i need to know the conversion between tablespoons and teaspoons,31,measurement_conversion,69,3
how many ounces in a gallon,31,measurement_conversion,69,3
how many tablespoons are in a cup,31,measurement_conversion,69,3
what's the conversion from inches to centimeters,31,measurement_conversion,69,3
what is 22 meters in inches,31,measurement_conversion,69,3
"if i have four inches, how many centimeters is that",31,measurement_conversion,69,3
how many pints are in 22 gallons,31,measurement_conversion,69,3
how do you convert ounces to kilos,31,measurement_conversion,69,3
i wanna know how many teaspoons are in a tablespoon,31,measurement_conversion,69,3
how would i go about converting inches to yards,31,measurement_conversion,69,3
how do you convert miles to kilometers,31,measurement_conversion,69,3
how many teaspoons in a cup,31,measurement_conversion,69,3
what's my current mpg,142,mpg,72,1
average mpg,142,mpg,72,1
look up the gas mileage for my vehicle,142,mpg,72,1
how many miles per gallon do i get in my car,142,mpg,72,1
what are the estimates for the car's highway mpg,142,mpg,72,1
how far can the car get per gallon on the highway,142,mpg,72,1
how many miles can i drive on 1 gallon of gas,142,mpg,72,1
how much mpg does this car get in the city,142,mpg,72,1
what's the mileage on my car,142,mpg,72,1
what's the non-city mpg for this car,142,mpg,72,1
what's my gas mileage like,142,mpg,72,1
can you give me the car's mpg for the city,142,mpg,72,1
what is the gas mileage for the car that i drive,142,mpg,72,1
how expensive is it to fuel this car,142,mpg,72,1
what is the city mpg for this car,142,mpg,72,1
do you know the fuel economy of this car,142,mpg,72,1
what’s my gas mileage,142,mpg,72,1
how many miles per gallon does this car get in the city,142,mpg,72,1
what is the mpg,142,mpg,72,1
how many miles will a gallon of gas take this car,142,mpg,72,1
go forward one song,118,next_song,75,0
proceed to the next song on this playlist,118,next_song,75,0
move on to the next song,118,next_song,75,0
i want to listen to another song,118,next_song,75,0
go to my next song,118,next_song,75,0
skip to the next song please,118,next_song,75,0
play the next track,118,next_song,75,0
play the next song,118,next_song,75,0
i would like to hear the next tune on this particular playlist,118,next_song,75,0
next song play,118,next_song,75,0
can you fast forward to the next song,118,next_song,75,0
skip to next song,118,next_song,75,0
go forward to the next track,118,next_song,75,0
"i don't want this song, move to the next",118,next_song,75,0
could you play the next song on this playlist,118,next_song,75,0
pass this song,118,next_song,75,0
stop this song and go to the next one,118,next_song,75,0
can we skip this song,118,next_song,75,0
give me the next song,118,next_song,75,0
hop to the next one,118,next_song,75,0
that is not true,30,no,76,3
i do not believe that that is correct,30,no,76,3
"no, that's incorrect",30,no,76,3
that's not what i want!,30,no,76,3
what you just said is false,30,no,76,3
that is false,30,no,76,3
"please, no",30,no,76,3
that's incorrect!,30,no,76,3
that's inaccurate,30,no,76,3
no that isn't it,30,no,76,3
that is erroneous,30,no,76,3
"that's not right, so no",30,no,76,3
that is a completely false statement,30,no,76,3
that's not right,30,no,76,3
"i do not think that is true, so i would say it is a false statement",30,no,76,3
i would have to say the answer to that is no,30,no,76,3
i disagree that is false,30,no,76,3
that'd be a no,30,no,76,3
that's a negative,30,no,76,3
"that would be ""no",30,no,76,3
can i get new checks to replace the ones we ran out of,127,order_checks,81,2
how can i order some more checks for my checking account,127,order_checks,81,2
i'd like to order more checks for my savings account,127,order_checks,81,2
i need more checkbooks for my chase account,127,order_checks,81,2
would it be possible for you to mail me new checkbooks,127,order_checks,81,2
i need to order more checkbooks by mail,127,order_checks,81,2
i would like to get some more checkbooks mailed to me,127,order_checks,81,2
order some new checks to replace the ones i ran out of,127,order_checks,81,2
how can i get more checks for my commerce bank checking account,127,order_checks,81,2
i feel i would like to get some more checkbooks mailed to me,127,order_checks,81,2
tell my bank i need new checks,127,order_checks,81,2
i wanna order some more checks for my checking account,127,order_checks,81,2
can you order me more checks at wells fargo,127,order_checks,81,2
"i have no more checks, how can i order more",127,order_checks,81,2
i want to order some more checks for my savings account,127,order_checks,81,2
i do need to get some more checkbooks mailed to me,127,order_checks,81,2
is is possible to order more checkbooks for account ending in sequence 939392,127,order_checks,81,2
can i please get some more checkbooks mailed to me,127,order_checks,81,2
i need to get some more checkbooks mailed to me,127,order_checks,81,2
can you order new checks for my citizens checking,127,order_checks,81,2
i'd like to pay my coned bill,111,pay_bill,83,1
i need to get help paying my gas bill,111,pay_bill,83,1
i want to pay my car bill,111,pay_bill,83,1
i'd like to pay my bill,111,pay_bill,83,1
can you give me a hand paying my water bill,111,pay_bill,83,1
i need to pay my mortgage,111,pay_bill,83,1
i need help paying my hoa bill,111,pay_bill,83,1
go ahead and pay my american express bill now,111,pay_bill,83,1
i need anyone who can help me pay my electric bill,111,pay_bill,83,1
i want to pay my electric bill,111,pay_bill,83,1
please help me pay my cable bill,111,pay_bill,83,1
pay my mortgage from my checkings accounts,111,pay_bill,83,1
i need help paying my auto insurance bill,111,pay_bill,83,1
help me pay my cable bill,111,pay_bill,83,1
pay my cable bill from my facebook account,111,pay_bill,83,1
is it possible to pay my bill,111,pay_bill,83,1
i need help paying my phone bill,111,pay_bill,83,1
pay my cell bill from my deposit account,111,pay_bill,83,1
use my savings account to the pay the rent,111,pay_bill,83,1
can you pay the bill now,111,pay_bill,83,1
i want to change my pin number for my checking account,89,pin_change,85,0
can you tell me how i change my pin number,89,pin_change,85,0
change the pin on my wells fargo account to be 1234,89,pin_change,85,0
help me out with changing this pin number,89,pin_change,85,0
i want 1234 to be the new pin number for my joint account,89,pin_change,85,0
"i would like to change the pin on my savings account, please",89,pin_change,85,0
tell me how to retrieve my pin number,89,pin_change,85,0
i must change my pin number for my account,89,pin_change,85,0
i want a new pin for my savings account,89,pin_change,85,0
i'd like to change my pin number for my savings account,89,pin_change,85,0
change my pin to 1234 on account ending with digits 4994,89,pin_change,85,0
i need to change my pin number for my checking account,89,pin_change,85,0
help me remember my pin number,89,pin_change,85,0
change the pin on my capital one account to be 1234,89,pin_change,85,0
i forgot my pin number for my northfield account,89,pin_change,85,0
i want my savings account pin to be 1234 from now on,89,pin_change,85,0
i forgot my pin number to my chase account,89,pin_change,85,0
set my amex pin to 1234,89,pin_change,85,0
change the pin on my bofa account to 3892,89,pin_change,85,0
how do i get a new pin,89,pin_change,85,0
commence playing music,106,play_music,86,2
rock music playlist,106,play_music,86,2
yo play that song that go like she take my money,106,play_music,86,2
let's hear my workout playlist,106,play_music,86,2
i want to listen to music,106,play_music,86,2
i wanna play the song that goes like hey jude don't make it bad,106,play_music,86,2
please play the new lady gaga song,106,play_music,86,2
start up some music,106,play_music,86,2
play some rock,106,play_music,86,2
i want to play my maroon 5 playlist,106,play_music,86,2
play the song called blood brothers,106,play_music,86,2
play the song god's plan,106,play_music,86,2
"put my music on, please",106,play_music,86,2
resume my death metal playlist,106,play_music,86,2
can you play music the beatles,106,play_music,86,2
would you play my maroon 5 playlist,106,play_music,86,2
start playing my black metal playlist,106,play_music,86,2
i want to hear my hip hop playlist,106,play_music,86,2
can you put on music by beach house,106,play_music,86,2
do you have music by elvis,106,play_music,86,2
i want to know how many vacation days i can use,126,pto_balance,88,3
how much vacation am i currently entitled to,126,pto_balance,88,3
what is my vacation schedule look like,126,pto_balance,88,3
do i still have vacation days,126,pto_balance,88,3
how many vacation days do i have saved,126,pto_balance,88,3
i need to know how many vacation days i have,126,pto_balance,88,3
how many of my vacation days do i have remaining,126,pto_balance,88,3
check how much pto i have left,126,pto_balance,88,3
what's my vacation day total,126,pto_balance,88,3
i'd like to know how many vacation days i have,126,pto_balance,88,3
can you figure out how many vacation days i have left,126,pto_balance,88,3
what is my remaining pto days,126,pto_balance,88,3
what's the current amount of vacation owed to me,126,pto_balance,88,3
what's the count of vacation days i have left,126,pto_balance,88,3
how many days can i slack off this year,126,pto_balance,88,3
how many days do i have left of pto,126,pto_balance,88,3
how many vacation days do i have left this year,126,pto_balance,88,3
do i have enough pto to take time off,126,pto_balance,88,3
what pto time to i have remaining,126,pto_balance,88,3
what number of vacation days do i have,126,pto_balance,88,3
how many vacation days have i spent in total,148,pto_used,91,2
i need to know how many days so far i've taken off,148,pto_used,91,2
how many personal days have i taken,148,pto_used,91,2
i've used how much pto so far,148,pto_used,91,2
how many days so far have i taken off,148,pto_used,91,2
tell me the amount of pto i have used at this point,148,pto_used,91,2
how many personal days have i taken this month,148,pto_used,91,2
how many days did i skip work,148,pto_used,91,2
can you tell me how many vacation days i've taken,148,pto_used,91,2
how many of my vacation days have i depleted,148,pto_used,91,2
how many of my paid days off have i used,148,pto_used,91,2
what's the amount of time i've taken off work this year,148,pto_used,91,2
how much time did i take off so far,148,pto_used,91,2
how many days have i taken off so far,148,pto_used,91,2
check to see how many days off i have used in total so far,148,pto_used,91,2
"up to this point, how much of my pto have i used",148,pto_used,91,2
how much paid time off have i taken,148,pto_used,91,2
how many of my sick days have i gone through,148,pto_used,91,2
what's the total pto i've used,148,pto_used,91,2
what is the total number of vacation days i've used,148,pto_used,91,2
can you search for the best new york style cheesecake recipes please,104,recipe,92,1
can you find me a recipe for ribs,104,recipe,92,1
show me a beef recipe,104,recipe,92,1
find a recipe for german chocolate cake,104,recipe,92,1
can you get me a recipe for mashed potatoes,104,recipe,92,1
what are the steps i need to follow to make chewy rice krispies treats,104,recipe,92,1
where is a beef recipe,104,recipe,92,1
how do i make pumpkin pie,104,recipe,92,1
can you instruct me on how to make german chocolate cake,104,recipe,92,1
blackberry pie instructions,104,recipe,92,1
can you find me a recipe for quiche,104,recipe,92,1
how do i make lassagna,104,recipe,92,1
give me a beef recipe,104,recipe,92,1
how do i make the perfect omelette,104,recipe,92,1
i need a vegi lasagna recipe,104,recipe,92,1
how to make mac and cheese,104,recipe,92,1
what is needed you to cook apple pie,104,recipe,92,1
i need a quick recipe for spiral ham,104,recipe,92,1
please search for a chocolate fudge brownies recipe,104,recipe,92,1
i want to make sour dough bread please find a good recipe for me,104,recipe,92,1
remind me to call the vet tomorrow,53,reminder_update,95,0
"make a reminder, pay taxes on monday",53,reminder_update,95,0
set reminder to prepare for my meeting at 10 am,53,reminder_update,95,0
make a reminder to give the cat her flea medicine,53,reminder_update,95,0
i need a reminder set for signing up for the conference,53,reminder_update,95,0
set a reminder to bring a book to work tomorrow,53,reminder_update,95,0
can you create a reminder,53,reminder_update,95,0
set a reminder to go dress shopping,53,reminder_update,95,0
can i set a reminder,53,reminder_update,95,0
i want to get reminded to clean my room,53,reminder_update,95,0
"new reminder, please",53,reminder_update,95,0
i need to be reminded to pray,53,reminder_update,95,0
remind me to use the bathroom,53,reminder_update,95,0
dont let me forget to do that thing later,53,reminder_update,95,0
tell me to take out the trash in an hour,53,reminder_update,95,0
"at 4 tomorrow afternoon, remind me to start the oven",53,reminder_update,95,0
remind me to call bob,53,reminder_update,95,0
remind me,53,reminder_update,95,0
please reminder for car meet,53,reminder_update,95,0
set a reminder to remind me to check when my car payment is,53,reminder_update,95,0
ai i didn't hear you,13,repeat,96,3
"i need you to repeat that, please",13,repeat,96,3
i didn't hear you please repeat,13,repeat,96,3
i would like you to repeat yourself,13,repeat,96,3
i am going to need you to say that again,13,repeat,96,3
i did not understand say it again,13,repeat,96,3
excuse me,13,repeat,96,3
what was that,13,repeat,96,3
can you repeat yourself,13,repeat,96,3
replay what you just said,13,repeat,96,3
"would you say that again, please",13,repeat,96,3
"i didnt understand what you just said, can you say it again",13,repeat,96,3
repeat what you just told me,13,repeat,96,3
"i didn't hear, please say it again",13,repeat,96,3
hold on what was that you just said,13,repeat,96,3
please repeat yourself,13,repeat,96,3
could you ask the question again,13,repeat,96,3
i missed that say it again,13,repeat,96,3
"i did not hear you, please repeat",13,repeat,96,3
could you say that again,13,repeat,96,3
i suspect some suspicious activity,70,report_fraud,98,3
i need to report fraudulent activity on my mastercard,70,report_fraud,98,3
i'm afraid this charge on my account is fraud,70,report_fraud,98,3
i may have had fraud committed on my account,70,report_fraud,98,3
i think i made a fraudulent transaction,70,report_fraud,98,3
report fraud on my card,70,report_fraud,98,3
i need to report fraudulent activity on my card,70,report_fraud,98,3
there is a fraudulent charge for paypal on my bank account,70,report_fraud,98,3
i think my chase account has been compromised and fraud committed,70,report_fraud,98,3
i want to report fraudulent activity on my card,70,report_fraud,98,3
i have a fraudulent transaction from wal mart on my account,70,report_fraud,98,3
i spotted a fraudulent transaction from microsoft on my account,70,report_fraud,98,3
i have activity on my bank of america card i don't recognize,70,report_fraud,98,3
i have charges on my amex card i didn't make,70,report_fraud,98,3
i have suspicious charges on my discovery card,70,report_fraud,98,3
i need to make a report due to fraudulent activity on my card,70,report_fraud,98,3
i have a fraudulent transaction from wal mart showing on my account,70,report_fraud,98,3
there is an unauthorized transaction on my bank of america checking,70,report_fraud,98,3
my card has purchases i don't recognize,70,report_fraud,98,3
please report information about activity on my credit card,70,report_fraud,98,3
you have to reserve a table for 4 at red robin under the name kevin at 7,23,restaurant_reservation,101,2
can you get me a table for 8 at johnnys,23,restaurant_reservation,101,2
reserve a table for 3 at outback steakhouse under the name lance at 7:00pm,23,restaurant_reservation,101,2
can you make a reservation at the restaurant for tomorrow,23,restaurant_reservation,101,2
can you get me a table for 2 at mexico viejo at 3pm,23,restaurant_reservation,101,2
i want to have a table for 2 at the broadmore around 6,23,restaurant_reservation,101,2
book a reservation for 2 at olive garden under the name jim,23,restaurant_reservation,101,2
reserve a table for 4 at red robin under the name kevin at 7,23,restaurant_reservation,101,2
make a reservation for three at prime rib at 6:30 pm,23,restaurant_reservation,101,2
can you get me a table for 6 at lawry's at 7:30pm,23,restaurant_reservation,101,2
could you make reservations for 2 at olive garden for 5 pm today,23,restaurant_reservation,101,2
can you get me a table for 5 at outback steakhouse at 6:30pm,23,restaurant_reservation,101,2
can you make a reservation at the restaurant for tonight,23,restaurant_reservation,101,2
i need to make a reservation for 8 pm at red robin for 3,23,restaurant_reservation,101,2
is it possible to book a room at the taco bell for reavers at 3,23,restaurant_reservation,101,2
give me a table for 3 at o'reilly's bar for 7 please,23,restaurant_reservation,101,2
i'd like a reservation for 2 at olive garden for 5 pm today,23,restaurant_reservation,101,2
reserve a table for 5 at lawry's under the name steve at 8:00pm,23,restaurant_reservation,101,2
can you get me a table for 8 at mastro's at 8:30pm,23,restaurant_reservation,101,2
reserve a table for 2 at red lobster at 8:00,23,restaurant_reservation,101,2
how can i see my rewards for my chase card,50,rewards_balance,104,2
how would i be able to check my kohls rewards card,50,rewards_balance,104,2
help me check my visa rewards card,50,rewards_balance,104,2
what is my chase card's rewards balance,50,rewards_balance,104,2
tell me how to check rewards for my mastercard,50,rewards_balance,104,2
what is the reward balance on my discover card,50,rewards_balance,104,2
how many points have i already accrued on my chase mastercard,50,rewards_balance,104,2
how do i see me rewards for my chase card,50,rewards_balance,104,2
i have how many tier credits on my caesar's card,50,rewards_balance,104,2
how many points did i get on my discover card,50,rewards_balance,104,2
my starbucks rewards balance is,50,rewards_balance,104,2
can you tell me how many points i have to date with my capital one miles card,50,rewards_balance,104,2
what is my citigroup card's rewards balance,50,rewards_balance,104,2
give my my current points on my marriot rewards card,50,rewards_balance,104,2
what's the balance of my reward points on my discover card,50,rewards_balance,104,2
how many points have been earned on my amex,50,rewards_balance,104,2
what is the remainder of my starbucks rewards balance,50,rewards_balance,104,2
how many points are on my gold card,50,rewards_balance,104,2
"i would like my total rewards points balance on my bank of america platinum rewards card, please",50,rewards_balance,104,2
how do i get my rewards balance on my diner's club card,50,rewards_balance,104,2
i need a meeting scheduled with bob for 7:00am on 9/11,18,schedule_meeting,109,0
"at noon, schedule a meeting with saul",18,schedule_meeting,109,0
please tell me if there are meeting rooms available between 9:00 am and 11:00 am,18,schedule_meeting,109,0
what's the meeting room availability between noon and 2,18,schedule_meeting,109,0
i want to know how do i schedule a meeting,18,schedule_meeting,109,0
can you schedule a meeting with john for 12,18,schedule_meeting,109,0
how can you schedule a meeting for me,18,schedule_meeting,109,0
set a meeting with tom for 5:30 tomorrow,18,schedule_meeting,109,0
how can i schedule a meeting,18,schedule_meeting,109,0
are there rooms available between 5 and 530,18,schedule_meeting,109,0
a meeting needs to be schedule and i need to know how,18,schedule_meeting,109,0
are any rooms free from 12 to 1,18,schedule_meeting,109,0
is there an open meeting room between 2 and 4,18,schedule_meeting,109,0
