text,label,label_text,global_label,task_id
do they take reservations at red robin,9,accept_reservations,0,0
does hannahs in galloway take reservations,9,accept_reservations,0,0
do they take reservations at outback steakhouse,9,accept_reservations,0,0
does redrobin take reservations,9,accept_reservations,0,0
can applebees take any reservations,9,accept_reservations,0,0
does gramercy tavern accept reservations,9,accept_reservations,0,0
can i make a reservation for redrobin,9,accept_reservations,0,0
please find out if napolis takes lunch reservations,9,accept_reservations,0,0
does pizzeria delfina in san francisco take reservations,9,accept_reservations,0,0
does michael's accept reservations,9,accept_reservations,0,0
do they take reservations at buffalo wild wings,9,accept_reservations,0,0
does cielo take reservations,9,accept_reservations,0,0
does nopa in san francisco take reservations,9,accept_reservations,0,0
does stanleys take brunch reservations,9,accept_reservations,0,0
does ruby tuesday accept reservations,9,accept_reservations,0,0
does luigi's take reservations,9,accept_reservations,0,0
do they take reservations at applebees,9,accept_reservations,0,0
does buffalo wild wings do reservations,9,accept_reservations,0,0
are reservations taken at redrobin,9,accept_reservations,0,0
find out if la tour d'argent in paris takes reservations,9,accept_reservations,0,0
how can i track the progress of my credit card application,103,application_status,3,1
when will my credit card app be approved,103,application_status,3,1
i want to know if my credit card application has been processed yet,103,application_status,3,1
has my credit card application been approved,103,application_status,3,1
is it likely my credit card application has processed yet,103,application_status,3,1
have you heard anything back on my cc application,103,application_status,3,1
tell me the status of my credit card application,103,application_status,3,1
has the application for my american express been processed yet,103,application_status,3,1
my credit card application status,103,application_status,3,1
see if my form submission for an american express card has been seen,103,application_status,3,1
what is the status of my new credit card application,103,application_status,3,1
help with credit card application status,103,application_status,3,1
"i put in a credit card application, so what is the status with it currently",103,application_status,3,1
has the application i put in for a new visa been processed,103,application_status,3,1
in what status is my credit card application,103,application_status,3,1
"can you find out the latest on my credit card application, i haven't heard an update in some time",103,application_status,3,1
where can i go to see if my credit card application has been processed,103,application_status,3,1
do i have any updates about my credit card application,103,application_status,3,1
did the application i put in for a mastercard go through yet,103,application_status,3,1
i want to know if my application for a credit card at community bank has been approved or not,103,application_status,3,1
please cancel my dinner reservation for tuesday,67,cancel_reservation,16,2
"hello, i need to cancel tonight's reservation for dinner",67,cancel_reservation,16,2
cancel my reservations for joe's at zepher right now,67,cancel_reservation,16,2
my reservation for dinner needs to be canceled,67,cancel_reservation,16,2
i no longer need a table for four at chili's,67,cancel_reservation,16,2
can you cancel the reservation i have at 4 pm at ruth's,67,cancel_reservation,16,2
could i cancel my reservations,67,cancel_reservation,16,2
please cancel the reservation at zephers for joe and myself right now,67,cancel_reservation,16,2
abandon the dinner reservation i made,67,cancel_reservation,16,2
annul the reservation i created,67,cancel_reservation,16,2
call off the dinner reservation,67,cancel_reservation,16,2
cancel my party reservation for brad at longhorn,67,cancel_reservation,16,2
joe and i are to cancel the reservation at zephers now,67,cancel_reservation,16,2
cancel my dinner reservation please,67,cancel_reservation,16,2
i need to cancel my dinner reservation,67,cancel_reservation,16,2
cancel my reservation for chris at jp field's,67,cancel_reservation,16,2
please cancel my reservation for dinner,67,cancel_reservation,16,2
cancel tonight's dinner reservation,67,cancel_reservation,16,2
"i don't need my reservation, cancel it",67,cancel_reservation,16,2
can i cancel my reservations please,67,cancel_reservation,16,2
find out why my card declined yesterday,49,card_declined,18,1
let me know why my card got declined the other day,49,card_declined,18,1
i wanna know why my card was declined,49,card_declined,18,1
find out what happened to make my card get declined yesterday,49,card_declined,18,1
how come my card was not accepted yesterday,49,card_declined,18,1
how come starbucks declined my card when i tried to use it to pay,49,card_declined,18,1
i don't understand why my card was declined yesterday,49,card_declined,18,1
why did you decline my card at sfo,49,card_declined,18,1
my card didn't go through when i was buying a case of water at walmart,49,card_declined,18,1
i need to know why my card was declined,49,card_declined,18,1
my card was not accepted for buying a computer at best buy,49,card_declined,18,1
why did my card get rejected yesterday,49,card_declined,18,1
i wonder why my card got declined yesterday,49,card_declined,18,1
please tell me why my card was declined,49,card_declined,18,1
i was at safeway trying to buy groceries and my card got declined,49,card_declined,18,1
i need to know why my card declined yesterday,49,card_declined,18,1
why did my card get declined at the dentist office,49,card_declined,18,1
i was at walmart today and my card got declined when i went to buy qtips,49,card_declined,18,1
i was at whole foods trying to buy groceries and my card got declined,49,card_declined,18,1
i went to target to buy a mug but my card did not work,49,card_declined,18,1
tell me my credit rating,69,credit_score,30,1
how do i find out my credit rating,69,credit_score,30,1
how to see my credit score,69,credit_score,30,1
let me know my credit score,69,credit_score,30,1
what's my credit score,69,credit_score,30,1
what is the number of my credit score,69,credit_score,30,1
i would like to be told about my credit rating,69,credit_score,30,1
can you tell me my credit score,69,credit_score,30,1
lets look up my credit score,69,credit_score,30,1
inform me of my credit score,69,credit_score,30,1
what is my fica score,69,credit_score,30,1
how is my credit score rated,69,credit_score,30,1
what is my credit score,69,credit_score,30,1
say my credit score,69,credit_score,30,1
i am trying to find my credit score,69,credit_score,30,1
let me understand my credit rating,69,credit_score,30,1
get my credit score,69,credit_score,30,1
where can i find my credit score,69,credit_score,30,1
show me my credit score,69,credit_score,30,1
how do i locate my current credit score,69,credit_score,30,1
i can't use my damaged card,87,damaged_card,32,1
i demagnetized my card and want to report it,87,damaged_card,32,1
my card is too scratched up and i need to report it,87,damaged_card,32,1
i want to report my damaged card i accidentally cut it up thinking it was my expired card,87,damaged_card,32,1
i need a new card because my dog chewed on it and now it does not work,87,damaged_card,32,1
the magnetic strip on my card is scratched up pretty badly from overuse can i get a new one,87,damaged_card,32,1
"an atm ate my card, how do i report it",87,damaged_card,32,1
my card is damaged and no longer function,87,damaged_card,32,1
i broke my card,87,damaged_card,32,1
"unfortunately, my card is damaged and unusable",87,damaged_card,32,1
who do i report to if my credit card snaps,87,damaged_card,32,1
my card doesn't work anymore,87,damaged_card,32,1
"my card got melted in the dryer and i need to report it, please",87,damaged_card,32,1
i dropped my card in my gasoline and the printing wore off,87,damaged_card,32,1
"my card got scratched badly, can you tell my bank to send a replacement",87,damaged_card,32,1
the sticker on my card is peeling off,87,damaged_card,32,1
"my card is wrecked, let's report it",87,damaged_card,32,1
my card has been erased and i need to report it,87,damaged_card,32,1
"my card snapped, can you tell my bank to send a replacement",87,damaged_card,32,1
"i cut up the wrong card, please contact the bank and let them know",87,damaged_card,32,1
what types of pets do you own,34,do_you_have_pets,38,0
tell me if you like cats or dogs,34,do_you_have_pets,38,0
how many different pets do you have,34,do_you_have_pets,38,0
do you have any type of pet,34,do_you_have_pets,38,0
"think about if you could only say one or the other, which animal do you see yourself choosing, cats or dogs",34,do_you_have_pets,38,0
"what kind of person are you, a cat or dog",34,do_you_have_pets,38,0
what type of pet do you have,34,do_you_have_pets,38,0
"what sort of person are you, a cat or dog person",34,do_you_have_pets,38,0
"what is your favorite pet, a cat or a dog",34,do_you_have_pets,38,0
can you tell me about the pets you have,34,do_you_have_pets,38,0
what kind of pets live with you,34,do_you_have_pets,38,0
"specifically, what pets do you own",34,do_you_have_pets,38,0
"if you had to choose, cat or dog",34,do_you_have_pets,38,0
let me know about your pets,34,do_you_have_pets,38,0
what are your pets,34,do_you_have_pets,38,0
tell me about your pets,34,do_you_have_pets,38,0
what is your favourite pet,34,do_you_have_pets,38,0
what sort of animals are your pets,34,do_you_have_pets,38,0
do you own pets,34,do_you_have_pets,38,0
"if you had to choose, would you choose a cat or a dog",34,do_you_have_pets,38,0
what is the yen worth in terms of the peso,38,exchange_rate,39,0
i would love to know the exchange rate between rubles and pounds,38,exchange_rate,39,0
how many dollars can i exchange for 10000 yen,38,exchange_rate,39,0
tell me the exchange rate between dollars and pesos,38,exchange_rate,39,0
how much cad can i get with my one usd,38,exchange_rate,39,0
i wanna know five dollars in yen and rubles,38,exchange_rate,39,0
how many pesos can i get for one dollar,38,exchange_rate,39,0
what's the currency conversion between usd and pounds,38,exchange_rate,39,0
what's 10 euros in dollars,38,exchange_rate,39,0
i need the exchange rate between pounds and us dollars,38,exchange_rate,39,0
i need to know five dollars in yen and rubles,38,exchange_rate,39,0
how many dollars can i exchange for 75 euros,38,exchange_rate,39,0
what's 10 pounds in dollars,38,exchange_rate,39,0
tell me five dollars in yen and rubles,38,exchange_rate,39,0
what is the exchange rate for canadian dollars to us dollars,38,exchange_rate,39,0
what's the currency conversion between usd and yen,38,exchange_rate,39,0
what is 5 in yen and rubles,38,exchange_rate,39,0
how many canadian dollars can i get for 5 us dollars,38,exchange_rate,39,0
let me know what the exchange rate between dollars and pesos is,38,exchange_rate,39,0
what is the equal number of dollars i can exchange for 50 pesos,38,exchange_rate,39,0
when will my visa next expire,44,expiration_date,40,0
how long is it until my credit card expires,44,expiration_date,40,0
tell me the expiry month of my card,44,expiration_date,40,0
on what month and year does my card expire,44,expiration_date,40,0
look up the expiration date for my barclay's card,44,expiration_date,40,0
please find the expiration month listed on my card,44,expiration_date,40,0
how long til my visa card expires,44,expiration_date,40,0
please let me know when i need to renew my credit card,44,expiration_date,40,0
when is the date my visa card will expire,44,expiration_date,40,0
when's my visa card expiring,44,expiration_date,40,0
tell me the month my card expires,44,expiration_date,40,0
which month is the one in which my card expires,44,expiration_date,40,0
please look up my card's expiration date,44,expiration_date,40,0
how long until i my card expires,44,expiration_date,40,0
when is my card going to expire,44,expiration_date,40,0
how long is the validity of my credit card,44,expiration_date,40,0
when is my credit due to expire,44,expiration_date,40,0
can i have the expiration date for my capital one card,44,expiration_date,40,0
how soon does my visa card expire,44,expiration_date,40,0
how much longer until my credit card expires,44,expiration_date,40,0
tell me that status of flight dl123,80,flight_status,42,2
when will my flight land,80,flight_status,42,2
can you tell me when my flight is going to board,80,flight_status,42,2
whats the latest on flight dl123,80,flight_status,42,2
how long until delta is at the gate,80,flight_status,42,2
update me on my delta flight please,80,flight_status,42,2
when will my aa flight be landing,80,flight_status,42,2
tell me when my flight is landing,80,flight_status,42,2
when will my delta flight depart,80,flight_status,42,2
what is the scheduled arrival time for my flight,80,flight_status,42,2
what is the eta of my flight,80,flight_status,42,2
what is the word on flight dl123,80,flight_status,42,2
what time will my flight reach the destination,80,flight_status,42,2
look up when my flight is set to start boarding,80,flight_status,42,2
when is my flight supposed to leave,80,flight_status,42,2
what time is my flight supposed to be landing,80,flight_status,42,2
whats the status of my south west flight,80,flight_status,42,2
at what time will my flight begin boarding,80,flight_status,42,2
whats the most recent status for my virgin air flight,80,flight_status,42,2
when's my flight boarding,80,flight_status,42,2
i want to find out if this will hurt my credit,28,improve_credit_score,53,1
how can i ensure my credit score doesn't drop,28,improve_credit_score,53,1
is it possible to lower my credit score by doing this,28,improve_credit_score,53,1
how to keep credit score high,28,improve_credit_score,53,1
can i protect my credit score,28,improve_credit_score,53,1
how to protect my credit score,28,improve_credit_score,53,1
how do i build credit,28,improve_credit_score,53,1
how do i maintain my credit score,28,improve_credit_score,53,1
how do i prevent my credit score from lowering,28,improve_credit_score,53,1
how do i build my credit score,28,improve_credit_score,53,1
tell me ways to improve my credit score,28,improve_credit_score,53,1
does carrying a balance hurt my credit score,28,improve_credit_score,53,1
how can i improve my credit score,28,improve_credit_score,53,1
how to keep my credit score from going down,28,improve_credit_score,53,1
how is the credit score hurt,28,improve_credit_score,53,1
will doing this hurt my credit score,28,improve_credit_score,53,1
how do i keep good credit,28,improve_credit_score,53,1
how do i make my credit score better,28,improve_credit_score,53,1
so how can i hurt my credit score,28,improve_credit_score,53,1
i need a list of different methods for building my credit score,28,improve_credit_score,53,1
what is the surcharge for using my card in italy while i visit,137,international_fees,60,2
what are the fees for using my card in toronto,137,international_fees,60,2
will i be charged if i use my card in canada,137,international_fees,60,2
will my discover card ding me with transaction fees if i'm in aruba,137,international_fees,60,2
is there a fee associated with use of my card in burkina faso,137,international_fees,60,2
how much is the charge of using my card in italy during my stay there,137,international_fees,60,2
do i have to pay international transaction fees when i use my chase card,137,international_fees,60,2
will i be charged if i use my card in france,137,international_fees,60,2
what are the transaction fee using our card in florence if any,137,international_fees,60,2
"if i use my card in mexico, will there be added fees",137,international_fees,60,2
are there any transaction fee if i use my boston private card in scotland,137,international_fees,60,2
does my bank of the west card have international transaction fees,137,international_fees,60,2
will i be charged if i use my card in mexico,137,international_fees,60,2
give me a list of international transaction fees for my amex,137,international_fees,60,2
do i have to pay amex transaction fees in brazil,137,international_fees,60,2
does american express charge transaction fees for iceland,137,international_fees,60,2
if i use my card in denver will i get charged extra,137,international_fees,60,2
can i see all the international transaction fees on my amex,137,international_fees,60,2
does visa charge transaction fees in the uk,137,international_fees,60,2
what are my chase cards fees for international transactions,137,international_fees,60,2
do i need to apply for a travel visa if i am going to bermuda,59,international_visa,61,0
do i need to get a visa for traveling to chile,59,international_visa,61,0
i'm going to jamaica next week; am i needing a visa,59,international_visa,61,0
will i need a visa to visit ireland,59,international_visa,61,0
do i need a visa to travel to canada,59,international_visa,61,0
would i need a travel visa to go to the congo,59,international_visa,61,0
"to visit cambodia, do i need an international visa",59,international_visa,61,0
am i in need of an international visa to go to france,59,international_visa,61,0
does laos require a travel visa,59,international_visa,61,0
does mexico require an international visa,59,international_visa,61,0
i need to know if i must have an international visa to go to france,59,international_visa,61,0
is it necessary to apply for a tourist visa for mexico,59,international_visa,61,0
what paperwork will i need to visit northern ireland,59,international_visa,61,0
do i need a visa to travel to jamaica,59,international_visa,61,0
i'm vacationing in israel will i need a visa,59,international_visa,61,0
let me know if i need an international visa to go to sudan,59,international_visa,61,0
do i need an international visa to go to malaysia,59,international_visa,61,0
do i need an international visa to go to spain,59,international_visa,61,0
will i need a travel visa to go to canary islands,59,international_visa,61,0
should i get a travel visa for spain,59,international_visa,61,0
how long has it been since my last auto maintenance,37,last_maintenance,63,0
how long ago was my car last in the shop,37,last_maintenance,63,0
what date did i have my oil changed last,37,last_maintenance,63,0
when did i last take my car in for maintenance,37,last_maintenance,63,0
how long has it been since my car was last looked at,37,last_maintenance,63,0
what was the last time i had my car at the dealer for repairs,37,last_maintenance,63,0
tell me when my car last had its oil changed,37,last_maintenance,63,0
when was the last time i had an oil change,37,last_maintenance,63,0
when did last go to the auto repair shop,37,last_maintenance,63,0
please find the date of my last oil change,37,last_maintenance,63,0
tell me when someone looked at my car last,37,last_maintenance,63,0
when was the last time i changed my oil,37,last_maintenance,63,0
when did i go to the mechanic,37,last_maintenance,63,0
when was the last time i got my oil changed,37,last_maintenance,63,0
when was the last time my car was in the shop,37,last_maintenance,63,0
was my last oil change on wednesday,37,last_maintenance,63,0
let me know when my car was last looked at,37,last_maintenance,63,0
do you know when my car was last looked at,37,last_maintenance,63,0
can you find the date of my last oil change,37,last_maintenance,63,0
when did i last have a mechanic check out my car,37,last_maintenance,63,0
i need to call mark,25,make_call,65,0
call mark,25,make_call,65,0
please call toby,25,make_call,65,0
can you call dominos pizza,25,make_call,65,0
i must call jordan,25,make_call,65,0
call macy,25,make_call,65,0
place a phone call to yiming,25,make_call,65,0
can you call my mom,25,make_call,65,0
phone steven,25,make_call,65,0
i must call dr smith,25,make_call,65,0
dial x's phone please,25,make_call,65,0
it is important that i call katie,25,make_call,65,0
phonecall sarah,25,make_call,65,0
call friend,25,make_call,65,0
use my phone to dial work,25,make_call,65,0
can you make a phone call to mark,25,make_call,65,0
please phone lizzy,25,make_call,65,0
dial someone's phone number,25,make_call,65,0
can you redial the last number dialed,25,make_call,65,0
x is who i need to call,25,make_call,65,0
i don't know how to answer to that,121,maybe,66,2
not a clue,121,maybe,66,2
i haven't the foggiest,121,maybe,66,2
"maybe one, maybe the other",121,maybe,66,2
i don't have the answer,121,maybe,66,2
"might be true, might be false",121,maybe,66,2
not sure if that's a yes or a no,121,maybe,66,2
that answer's above my pay scale,121,maybe,66,2
im not certain,121,maybe,66,2
i can't answer that,121,maybe,66,2
really dont know,121,maybe,66,2
shit if i know,121,maybe,66,2
i haven't a clue,121,maybe,66,2
it depends,121,maybe,66,2
"sorry, i do not know",121,maybe,66,2
both maybe,121,maybe,66,2
i'm unsure of the proper answer,121,maybe,66,2
maybe,121,maybe,66,2
i am not confident on that,121,maybe,66,2
not quite sure how to respond,121,maybe,66,2
got any good dinner ideas,46,meal_suggestion,67,2
can you give me a burmese dinner suggestion,46,meal_suggestion,67,2
any suggestions for a peruvian meal,46,meal_suggestion,67,2
can you suggest meals from italy to me,46,meal_suggestion,67,2
go ahead and give me a suggestion for what to make for dinner,46,meal_suggestion,67,2
i need new dinner ideas,46,meal_suggestion,67,2
i'm looking for a good suggestion for norse cuisine,46,meal_suggestion,67,2
what peruvian dish should i make,46,meal_suggestion,67,2
what kind of mexican meal should i get,46,meal_suggestion,67,2
i'd like you to give me an idea for a meal from iceland,46,meal_suggestion,67,2
"i need to cook, what should i make",46,meal_suggestion,67,2
can you give me a vietnamese meal suggestion,46,meal_suggestion,67,2
let me pick your brain what do you think we should do for dinner tonight,46,meal_suggestion,67,2
do you know any greek dishes i could make for dinner,46,meal_suggestion,67,2
suggest a meal from thailand to me,46,meal_suggestion,67,2
what would you suggest for dinner,46,meal_suggestion,67,2
give me italian meal ideas,46,meal_suggestion,67,2
what should i have for dinner,46,meal_suggestion,67,2
what's the best pizza place around here,46,meal_suggestion,67,2
what's a good french meal,46,meal_suggestion,67,2
what is my average mpg in this car,142,mpg,72,1
what'll this car do for gas mileage on the open road,142,mpg,72,1
do you know what this car's mpg is,142,mpg,72,1
how many mpg does this car have,142,mpg,72,1
how many miles will a gallon of gas take this car,142,mpg,72,1
how expensive is it to fuel this car,142,mpg,72,1
how many miles per gallon am i getting,142,mpg,72,1
how many miles per gallon does it get on the highway,142,mpg,72,1
how's the fuel efficiency for city driving for this car,142,mpg,72,1
how many miles per gallon does my car get,142,mpg,72,1
what is the highway mpg on this car,142,mpg,72,1
does this car get good mpg on the highway,142,mpg,72,1
how many miles does my car get per gallon,142,mpg,72,1
"in my car, what's the fuel economy",142,mpg,72,1
whats the cars mpg,142,mpg,72,1
is the fuel economy of this car good or bad,142,mpg,72,1
what's the mpg for the car when it's on the highway,142,mpg,72,1
how much gas does this car use in the city,142,mpg,72,1
please tell me what the mpg is for this car,142,mpg,72,1
what is the mpg of this car,142,mpg,72,1
play the next song on this list,118,next_song,75,0
play the next song queued up,118,next_song,75,0
go to next song,118,next_song,75,0
please play the next song,118,next_song,75,0
play next song using this playlist,118,next_song,75,0
please put on the next number on this playlist,118,next_song,75,0
go past this song,118,next_song,75,0
play the song coming on next,118,next_song,75,0
beginning playing the next tune,118,next_song,75,0
"can you play the next song on this playlist, please",118,next_song,75,0
hop to the next one,118,next_song,75,0
play the next hit,118,next_song,75,0
listen to next song on playlist,118,next_song,75,0
move to the next song,118,next_song,75,0
give me the next song,118,next_song,75,0
play the next song instead,118,next_song,75,0
play the next tune,118,next_song,75,0
please play the next song on this playlist,118,next_song,75,0
go forward to the next song on the playlist,118,next_song,75,0
remember to play the next number on this particular playlist,118,next_song,75,0
how can i order some more checks for my checking account,127,order_checks,81,2
i need more checkbooks for my chase account,127,order_checks,81,2
i would like a reorder of checkbooks for my home equity line of credit with chase,127,order_checks,81,2
i would like to order additional checkbooks to me mailed to my home address,127,order_checks,81,2
i need to order more checkbooks for my capital one account,127,order_checks,81,2
i need to order more checks for my savings account,127,order_checks,81,2
i need to order new checks,127,order_checks,81,2
can you order new checks for my citizens checking,127,order_checks,81,2
i really need to order some more checks for my savings account,127,order_checks,81,2
how can i order more checkbooks by mail,127,order_checks,81,2
"i recently ran out of checks, so i wanna get some new ones",127,order_checks,81,2
if i need more checkbooks maild to me what should i do,127,order_checks,81,2
please submit an order for new checks on my pnc money market account,127,order_checks,81,2
can i get some more of those new checkbooks mailed to me,127,order_checks,81,2
my key bank checks have run out,127,order_checks,81,2
i feel i would like to get some more checkbooks mailed to me,127,order_checks,81,2
i don't have anymore checks for chase and need some,127,order_checks,81,2
"i'd like to get some more checkbooks mailed to me, if i can",127,order_checks,81,2
i need to get some more checkbooks mailed to me,127,order_checks,81,2
