text,label,label_text,global_label,task_id
name the five star attractions in gatlinburg,149,travel_suggestion,134,0
what are some activities to do in chicago,149,travel_suggestion,134,0
please suggest some fun tourist activities in tokyo,149,travel_suggestion,134,0
provide me with ideas of things we can do in charlotte,149,travel_suggestion,134,0
what's fun to do in thailand,149,travel_suggestion,134,0
can you give me some suggestions to go site seeing when i get there,149,travel_suggestion,134,0
what are the main attractions in gatlinburg,149,travel_suggestion,134,0
what fun is there to do in england,149,travel_suggestion,134,0
are there any fun tourist activities in australia,149,travel_suggestion,134,0
what are some good restaurants in chicago,149,travel_suggestion,134,0
what do you recommend to do in vegas,149,travel_suggestion,134,0
what things are there to do in portland,149,travel_suggestion,134,0
what are some of the attractions in gatlinburg,149,travel_suggestion,134,0
what are your best travel suggestions,149,travel_suggestion,134,0
show me some things to do in gatlinburg,149,travel_suggestion,134,0
what's the best place to travel to this time of year,149,travel_suggestion,134,0
are there any exciting tourist things to do in boston,149,travel_suggestion,134,0
i need help with some fun tourist things to do in tokyo,149,travel_suggestion,134,0
is there anything fun to do in berlin,149,travel_suggestion,134,0
put dr feelgood by motley crue on my playlist,141,update_playlist,136,1
add this song to my top 40 playlist,141,update_playlist,136,1
will you add what i'm listening to to my work playlist,141,update_playlist,136,1
can you add passionfruit by yaeji to my playlist,141,update_playlist,136,1
i want to have happy added to my rb playlist,141,update_playlist,136,1
get happy on my rb playlist,141,update_playlist,136,1
transfer happy to my rb playlist,141,update_playlist,136,1
will you please add cannons by phil wickham to my playlist,141,update_playlist,136,1
this song needs to be added to my reggae playlist,141,update_playlist,136,1
add to my playlist smooth operator by sade,141,update_playlist,136,1
put this song on my reggae playlist,141,update_playlist,136,1
put this song in vibes playlist,141,update_playlist,136,1
could you insert broken by evanescence to my music,141,update_playlist,136,1
please add someday by the strokes to my playlist,141,update_playlist,136,1
add mia to my spanish playlist,141,update_playlist,136,1
please add the immigrant song by led zeppelin to my playlist,141,update_playlist,136,1
can you please add hero by skillet to my playlist,141,update_playlist,136,1
"include this song in the ""kids"" playlist",141,update_playlist,136,1
add single ladies by beyonce to my pop playlist,141,update_playlist,136,1
i gotta add hey jude by the beatles to my playlist,141,update_playlist,136,1
what would you like to call me,11,user_name,137,2
do you know my name,11,user_name,137,2
i wanna know what do you call me,11,user_name,137,2
say what you think my name is,11,user_name,137,2
what do you have my name saved under,11,user_name,137,2
what will you call me,11,user_name,137,2
what name do you have listed for me,11,user_name,137,2
let me know the name you have for me,11,user_name,137,2
what do you say for my name,11,user_name,137,2
can you tell me what you refer to me as,11,user_name,137,2
please tell me the name you use for me,11,user_name,137,2
what name do you use when addressing me,11,user_name,137,2
so what is my current name saved as,11,user_name,137,2
what are you going to refer to me as,11,user_name,137,2
i want you to guess my name,11,user_name,137,2
tell me my designation,11,user_name,137,2
by what name people call me,11,user_name,137,2
you wrote what for my name,11,user_name,137,2
what name am i under,11,user_name,137,2
what is the name you have listed for my identity,11,user_name,137,2
i wish to know your hobbies,15,what_are_your_hobbies,141,0
"what do you do when you're not working, for fun",15,what_are_your_hobbies,141,0
what are the things you like to do for fun,15,what_are_your_hobbies,141,0
what do you like to do in your spare time,15,what_are_your_hobbies,141,0
what hobbies do you like,15,what_are_your_hobbies,141,0
do ai have hobbies and if so what are yours,15,what_are_your_hobbies,141,0
what kinds of things are you into,15,what_are_your_hobbies,141,0
so what sort of hobbies are you into,15,what_are_your_hobbies,141,0
what hobbies do you like to partake in,15,what_are_your_hobbies,141,0
how do you like to spend your free time,15,what_are_your_hobbies,141,0
is there anything you like to do in your free time,15,what_are_your_hobbies,141,0
let's talk about your hobbies,15,what_are_your_hobbies,141,0
what kind of hobbies do you like to do,15,what_are_your_hobbies,141,0
what do you like to do when you're not working,15,what_are_your_hobbies,141,0
what you do at the free time,15,what_are_your_hobbies,141,0
what are some things you like doing,15,what_are_your_hobbies,141,0
what do you like to do when you have spare time,15,what_are_your_hobbies,141,0
what types of activities do you enjoy,15,what_are_your_hobbies,141,0
what do you do for fun,15,what_are_your_hobbies,141,0
can you tell me about your hobbies,15,what_are_your_hobbies,141,0
switch to your whispering voice please,14,whisper_mode,146,2
is it possible for you to whisper for me,14,whisper_mode,146,2
please use whisper,14,whisper_mode,146,2
volume to whisper voice,14,whisper_mode,146,2
please shut off whisper mode for now,14,whisper_mode,146,2
do not talk so loudly,14,whisper_mode,146,2
please switch to whisper,14,whisper_mode,146,2
please talk quietly,14,whisper_mode,146,2
can you switch out of whisper mode,14,whisper_mode,146,2
please only use a whisper when speaking,14,whisper_mode,146,2
shh please speak with a whisper,14,whisper_mode,146,2
whisper mode off,14,whisper_mode,146,2
please whisper,14,whisper_mode,146,2
you need to speak softer,14,whisper_mode,146,2
don't make too much noise,14,whisper_mode,146,2
can you whisper,14,whisper_mode,146,2
go into whisper mode now please,14,whisper_mode,146,2
turn your volume up,14,whisper_mode,146,2
i decide to switch out of whisper mode,14,whisper_mode,146,2
switch to the whisper mode,14,whisper_mode,146,2
