text,label,label_text,global_label,task_id
is it possible to get more checkbooks for my navy fed account,127,order_checks,81,2
can you help me pay my phone bill,111,pay_bill,83,1
i want to pay my rent bill,111,pay_bill,83,1
pay the cable bill with my visa card,111,pay_bill,83,1
i need your help to pay my gas bill,111,pay_bill,83,1
can you pay the bill now,111,pay_bill,83,1
help me pay my cable bill,111,pay_bill,83,1
i want to pay that bill now,111,pay_bill,83,1
i want to do a payment on my water bill,111,pay_bill,83,1
i got to pay my cable bill,111,pay_bill,83,1
i want to pay my house bill,111,pay_bill,83,1
pay my cable bill from my checking account,111,pay_bill,83,1
i gotta pay my cable bill,111,pay_bill,83,1
i need help paying my tuition bill,111,pay_bill,83,1
can i pay a bill,111,pay_bill,83,1
i need help paying my water bill,111,pay_bill,83,1
please tell me how to pay my gas bill,111,pay_bill,83,1
do a car payment from my savings account,111,pay_bill,83,1
help me pay my electric bill,111,pay_bill,83,1
i really want to pay my cable bill from my checking account,111,pay_bill,83,1
pay a bribe using my money market account,111,pay_bill,83,1
can you help me remember my pin to my boa account,89,pin_change,85,0
change my pin number for my checking account,89,pin_change,85,0
tell me how i can get a new pin number,89,pin_change,85,0
i have no idea what the pin is for my checking account,89,pin_change,85,0
change the pin on my chase account to be 1234,89,pin_change,85,0
i'm afraid i've forgotten the pin for my 401k account,89,pin_change,85,0
how do i change my pin for number for my abc bank account,89,pin_change,85,0
how do i change my pin number for my payroll account,89,pin_change,85,0
help me get my pin on my capitol one account changed to 3892,89,pin_change,85,0
i cant recall my pin number for my city first account,89,pin_change,85,0
how do i get a new pin,89,pin_change,85,0
i would like to replace the pin number for my retirement account,89,pin_change,85,0
tell me how to change my pin number,89,pin_change,85,0
change my amex account pin to 1234,89,pin_change,85,0
change the pin on my bofa account to 3892,89,pin_change,85,0
what is the procedure for getting a new pin number,89,pin_change,85,0
"how do i get my pin number, i forgot mine",89,pin_change,85,0
"how do i update my pin number for my account, please",89,pin_change,85,0
i cannot recall the pin for my savings account,89,pin_change,85,0
i'd like to change my pin number for my checking account,89,pin_change,85,0
rock music playlist,106,play_music,86,2
let's hear my workout playlist,106,play_music,86,2
can you let me listen to elvis,106,play_music,86,2
can you play music,106,play_music,86,2
play my post-rock playlist,106,play_music,86,2
can u play the song that sound like bells going off,106,play_music,86,2
play the song that goes like hey jude don't make it bad,106,play_music,86,2
do you have music by elvis,106,play_music,86,2
i need for you to play my maroon 5 playlist,106,play_music,86,2
please play 1979 by the smashing pumpkins,106,play_music,86,2
i need to play the song that goes like hey jude don't make it bad,106,play_music,86,2
may i hear some music by fleet foxes,106,play_music,86,2
can you play elvis,106,play_music,86,2
turn on the rap playlist,106,play_music,86,2
play rock playlist,106,play_music,86,2
i want to play my maroon 5 playlist,106,play_music,86,2
play some music,106,play_music,86,2
i need to listen to my beyonce playlist,106,play_music,86,2
can you put on music by beach house,106,play_music,86,2
play heart shaped box,106,play_music,86,2
i need to know how many days so far i've taken off,148,pto_used,91,2
i've used how much pto so far,148,pto_used,91,2
how many vacation days did i use,148,pto_used,91,2
what's the number of day's i've taken off,148,pto_used,91,2
which days did i take vacation,148,pto_used,91,2
how many vacation days have i consumed,148,pto_used,91,2
i need to know how many of my days off i have used at this point,148,pto_used,91,2
what is the total number of vacation days i've used,148,pto_used,91,2
please find out how many of my vacation days i have spent,148,pto_used,91,2
check to see how many days off i have used,148,pto_used,91,2
look up my total number of days off so far,148,pto_used,91,2
what amount of days off have i already utilized,148,pto_used,91,2
how many vacation days have i used up,148,pto_used,91,2
how much vacation have i already used this year,148,pto_used,91,2
"including the day i missed because of snow, how much time have i take off work so far",148,pto_used,91,2
how many of my vacation days have i depleted,148,pto_used,91,2
"how many sick, personal, and vacation days have i billed so far this year",148,pto_used,91,2
what amount of pto have i taken,148,pto_used,91,2
what's the total pto i've used,148,pto_used,91,2
please find out how many days off i have used by this point,148,pto_used,91,2
what steps are involved in making lasagna,104,recipe,92,1
how do you make blackberry pie,104,recipe,92,1
i need help finding a recipe for enchiladas,104,recipe,92,1
i need a really good recipe for making doughnuts,104,recipe,92,1
i want to make sour dough bread please find a good recipe for me,104,recipe,92,1
how do i make the perfect omelette,104,recipe,92,1
is there a recipe for chili i can use,104,recipe,92,1
how do i make lemon merengue pie,104,recipe,92,1
tell me how to make beef wellington,104,recipe,92,1
i would like you to help me find a chow mein recipe,104,recipe,92,1
how do i make beef stroganoff,104,recipe,92,1
what is a good chili recipe,104,recipe,92,1
you know procedure to cook apple pie,104,recipe,92,1
do you know how to make chow mein,104,recipe,92,1
can you find me a recipe for cheese cake,104,recipe,92,1
can you find me a recipe for pasta,104,recipe,92,1
search for a macaroni and cheese recipe,104,recipe,92,1
can you teach me how to make sushi,104,recipe,92,1
can you find me a recipe for sugar cookies,104,recipe,92,1
i want a good recipe that shows me how to bake chocolate chip cookies from scratch,104,recipe,92,1
give me a reminder for calling bill,53,reminder_update,95,0
please remind me later,53,reminder_update,95,0
set a reminder for me to take my meds,53,reminder_update,95,0
make a reminder for me to do my resume,53,reminder_update,95,0
set a reminder to pick up the kids,53,reminder_update,95,0
please make a reminder,53,reminder_update,95,0
remind me to call my mother saturday morning,53,reminder_update,95,0
set a reminder for later,53,reminder_update,95,0
set reminder to feed cat tonight at 6pm,53,reminder_update,95,0
set a reminder to take out the trash,53,reminder_update,95,0
set a reminder to remind me to check when my car payment is,53,reminder_update,95,0
please give me a reminder,53,reminder_update,95,0
set reminder pay taxes on monday,53,reminder_update,95,0
remind me again please,53,reminder_update,95,0
please reminder for car meet,53,reminder_update,95,0
i'd like to have a reminder made,53,reminder_update,95,0
add a reminder to pick milk up at the store,53,reminder_update,95,0
please remind me to do this later,53,reminder_update,95,0
remind me to take out the garbage in the morning,53,reminder_update,95,0
can you set me a reminder,53,reminder_update,95,0
can you get me a table for 8 at johnnys,23,restaurant_reservation,101,2
can you make a reservation at the restaurant for tomorrow,23,restaurant_reservation,101,2
make a reservation for 2 at red lobster at 8pm,23,restaurant_reservation,101,2
can you get me a table for 3 at captain d's at 2pm,23,restaurant_reservation,101,2
i think i need to make a reservation for 8 pm at red robin for 3,23,restaurant_reservation,101,2
reserve a table for 4 at red lobster under the name dave at 7:30pm,23,restaurant_reservation,101,2
i gotta make a reservation for 8 pm at red robin for 3,23,restaurant_reservation,101,2
reserve a table for 2 at red lobster at 8:00,23,restaurant_reservation,101,2
can i have a table held at the outback steakhouse for johnson at 5,23,restaurant_reservation,101,2
i need an 8 o'clock reservation at pizza hut for the last name mercury,23,restaurant_reservation,101,2
i'd like to set up a reservation for kibble at 4,23,restaurant_reservation,101,2
"i think we should reserve dad's regular table friday for 6 people, use his name, make that close to 4:00 pm at the club",23,restaurant_reservation,101,2
check reservation availability for 2 at red lobster at 8pm,23,restaurant_reservation,101,2
can you get me a table for 3 at olive garden at 7pm,23,restaurant_reservation,101,2
can you get me a table for 6 at mark's at 11am,23,restaurant_reservation,101,2
can you get me a table for 6 at lawry's at 7:30pm,23,restaurant_reservation,101,2
can you get me a table for 1 at the vega at 1pm,23,restaurant_reservation,101,2
book a reservation for 5 at lawry's under the name chris,23,restaurant_reservation,101,2
can you get me a table for 8 at mastro's at 8:30pm,23,restaurant_reservation,101,2
can i make a reservation for 8 pm at red robin for 3,23,restaurant_reservation,101,2
how would i be able to check my kohls rewards card,50,rewards_balance,104,2
what is my chase card's rewards balance,50,rewards_balance,104,2
what's my reward balance on my amex card,50,rewards_balance,104,2
how can i look at rewards for my amex card,50,rewards_balance,104,2
how many points do i have in total on my marriot rewards card,50,rewards_balance,104,2
can i check my gold rewards card online,50,rewards_balance,104,2
what's my total point number on my mastercard,50,rewards_balance,104,2
how do i get my rewards balance on my diner's club card,50,rewards_balance,104,2
how many points did i get on my visa card,50,rewards_balance,104,2
how many rewards points do i have for my visa card,50,rewards_balance,104,2
i need to know my rewards balance on my discover card,50,rewards_balance,104,2
what's the current reward amount on my mastercard,50,rewards_balance,104,2
what the current balance of reward points on my mastercard,50,rewards_balance,104,2
what is the easiest way to check my bank rewards card,50,rewards_balance,104,2
what is my bank of america card's rewards balance,50,rewards_balance,104,2
how many points did i get on my discover card,50,rewards_balance,104,2
how can i see my rewards for my visa card,50,rewards_balance,104,2
what's the amount of points i have earned with my discover card,50,rewards_balance,104,2
"i would like my total rewards points balance on my bank of america platinum rewards card, please",50,rewards_balance,104,2
how many points do i have on my mastercard,50,rewards_balance,104,2
how is a meeting scheduled,18,schedule_meeting,109,0
schedule a meeting for me,18,schedule_meeting,109,0
add a new meeting with tom for 6pm,18,schedule_meeting,109,0
are there any meetings room available between 8:00 and 9:00 am,18,schedule_meeting,109,0
see if you can schedule a meeting with don southerland tomorrow at noon,18,schedule_meeting,109,0
"can you schedule a meeting with steve at the office, please",18,schedule_meeting,109,0
i want to know if there is meeting room available at 8,18,schedule_meeting,109,0
i need to schedule a meeting,18,schedule_meeting,109,0
are there any open meeting rooms between noon and 1,18,schedule_meeting,109,0
what is the availability of meeting rooms during the afternoon,18,schedule_meeting,109,0
i want to schedule a meeting with tom for 6pm,18,schedule_meeting,109,0
how do i create a meeting,18,schedule_meeting,109,0
i'd like to pencil in a meeting with seth at 11am,18,schedule_meeting,109,0
add a meeting with tom at 6pm,18,schedule_meeting,109,0
can you hook me up with a meeting room on saturday morning at 10am,18,schedule_meeting,109,0
schedule a meeting with tom for 6pm,18,schedule_meeting,109,0
are there any meeting rooms free from 10:00 am until 10:30 am,18,schedule_meeting,109,0
please help me schedule a meeting with john love at 9 am tomorrow,18,schedule_meeting,109,0
i want to check if there is any meeting room available between 8:00 and 10:00 am,18,schedule_meeting,109,0
how can i create a meeting,18,schedule_meeting,109,0
my friend steve needs my gps coordinates send them to him,58,share_location,110,2
please show my current location to andre,58,share_location,110,2
send my location to ben and jerry,58,share_location,110,2
share my location with ma,58,share_location,110,2
gps coordinates share with home,58,share_location,110,2
give me current gps coordinates to my sister,58,share_location,110,2
i need you to let mr miyagi and daniel know where i am,58,share_location,110,2
let ben and jerry know where i am,58,share_location,110,2
i need to share my location with trey,58,share_location,110,2
please tell my location to bob,58,share_location,110,2
can you tell bob and alice where i am,58,share_location,110,2
tell john and sam where i am,58,share_location,110,2
can you show ben and jerry where i am currently at,58,share_location,110,2
send my current location to my superior,58,share_location,110,2
let shih chieh see my location,58,share_location,110,2
how can i show noel where i am right now,58,share_location,110,2
"share my location with mom, please",58,share_location,110,2
i need you to send my location to paul and ryan,58,share_location,110,2
how do i share my location with noel,58,share_location,110,2
can you share my current location with amy,58,share_location,110,2
disconnect from my phone please,130,sync_device,116,2
please link up to my cell,130,sync_device,116,2
do you have access to my phone,130,sync_device,116,2
establish a connection to my phone,130,sync_device,116,2
pair with my phone,130,sync_device,116,2
you must connect to my phone,130,sync_device,116,2
"disconnect from my phone now, please",130,sync_device,116,2
are you able to link to my phone,130,sync_device,116,2
connect to my phone for me,130,sync_device,116,2
please connect with my phone,130,sync_device,116,2
connect with my phone please,130,sync_device,116,2
please link up to my phone,130,sync_device,116,2
can you get access to my phone right now,130,sync_device,116,2
you have to connect to my phone,130,sync_device,116,2
i don't want this phone synced any more,130,sync_device,116,2
would you connect to my phone,130,sync_device,116,2
desync from my iphone,130,sync_device,116,2
i need to disconnect from my phone,130,sync_device,116,2
would you disconnect from my phone,130,sync_device,116,2
could you connect to my phone,130,sync_device,116,2
tell me a funny joke,36,tell_joke,118,2
would you tell me a joke,36,tell_joke,118,2
tell me a joke about baseball,36,tell_joke,118,2
tell me something funny,36,tell_joke,118,2
i would like to hear a funny joke,36,tell_joke,118,2
i wanna hear something funny,36,tell_joke,118,2
can you tell me a joke about politicians,36,tell_joke,118,2
what's the funniest thing you know about peanuts,36,tell_joke,118,2
i could really use a laugh right now,36,tell_joke,118,2
tell me a joke about politicians,36,tell_joke,118,2
can you tell me a joke,36,tell_joke,118,2
can you tell me any truly funny knock knock jokes,36,tell_joke,118,2
i'd like to hear a joke about donkeys,36,tell_joke,118,2
what jokes do you know,36,tell_joke,118,2
please tell me a joke,36,tell_joke,118,2
say something funny,36,tell_joke,118,2
make me laugh,36,tell_joke,118,2
can you make me laugh,36,tell_joke,118,2
tell me something funny about politics,36,tell_joke,118,2
tell me a joke about cars,36,tell_joke,118,2
i want you to send a text message for me,26,text,119,1
send a text message to alice,26,text,119,1
compose text message,26,text,119,1
please send a message to peter telling him to pick up milk,26,text,119,1
create a new text message,26,text,119,1
can you send a text for me,26,text,119,1
please send a text,26,text,119,1
send my brother mike a text that says i'm home,26,text,119,1
text nick and tell him the car's ready,26,text,119,1
can you text kayla and tell them im running late,26,text,119,1
can you text mary and tell them it's ready,26,text,119,1
can you text the sgt adam and tell them i found the missing girl,26,text,119,1
send ally a text message the message is that i just landed,26,text,119,1
text roderick and tell him im running late,26,text,119,1
text william and ask him to pick up organic apples tonight,26,text,119,1
send a text message for me,26,text,119,1
i need you to text someone for me,26,text,119,1
text a message to alice,26,text,119,1
write text message to someone,26,text,119,1
please send a text to phil and ask him if he wants to play golf this weekend,26,text,119,1
what timezone is boise in,66,timezone,123,1
does phoenix have a different timezone,66,timezone,123,1
what timezone is melbourne in,66,timezone,123,1
las vegas timezone please,66,timezone,123,1
tell me the timezone las vegas is in,66,timezone,123,1
las vegas is in what timezone,66,timezone,123,1
does the central timezone include austin,66,timezone,123,1
what timezone is russia in,66,timezone,123,1
doy ou know what timezone chicago is in,66,timezone,123,1
for italy what timezone is it in,66,timezone,123,1
do you know what the timezone is in reno,66,timezone,123,1
find the applicable timezone for austin,66,timezone,123,1
i need to know what timezone ireland is in,66,timezone,123,1
italy's timezone is what,66,timezone,123,1
i need to know what timezone sedona is in,66,timezone,123,1
what's chicago's time zone,66,timezone,123,1
time zone in miami is what like,66,timezone,123,1
"if you're in melbourne, what timezone are you in",66,timezone,123,1
can you tell my what france's timezone is,66,timezone,123,1
in what timezone is nigeria,66,timezone,123,1
delete my to do list,65,todo_list_update,127,1
i need to do cleaning so add it to my to do list,65,todo_list_update,127,1
add dishes to my list,65,todo_list_update,127,1
place cleaning the backyard on my list of things to do,65,todo_list_update,127,1
can you put mopping on my to do list,65,todo_list_update,127,1
will you add mopping to my to do list please,65,todo_list_update,127,1
throw mopping onto my to do list,65,todo_list_update,127,1
i want you to clear out my to do list,65,todo_list_update,127,1
help remind me that i need to add laundry to my list of housework,65,todo_list_update,127,1
make my todo list blank,65,todo_list_update,127,1
add change filters to my to do list,65,todo_list_update,127,1
add mop bathroom to my to do list,65,todo_list_update,127,1
delete everything from the task list,65,todo_list_update,127,1
add clean bathroom to my to do list,65,todo_list_update,127,1
add grocery shopping to my list of things to do,65,todo_list_update,127,1
add clean the bathroom to my task list,65,todo_list_update,127,1
make sure my to do list is completely clear please,65,todo_list_update,127,1
please put cleaning on my list of things to do,65,todo_list_update,127,1
clear out my entire todo list,65,todo_list_update,127,1
please erase everything on my to do list,65,todo_list_update,127,1
is there traffic to work,24,traffic,128,1
will traffic be light on the way to orlando,24,traffic,128,1
traffic looking alright going towards burger king,24,traffic,128,1
what's traffic usually like around 5pm going to the bank,24,traffic,128,1
what's the traffic like to city hall,24,traffic,128,1
is the traffic backed up at the closest circle k,24,traffic,128,1
what is the traffic situation at the olive garden restaurant,24,traffic,128,1
what's the traffic like on the way to patterson,24,traffic,128,1
will i hit traffic on route to moms,24,traffic,128,1
what is the traffic like on the way to makaha,24,traffic,128,1
tell me how traffic is looking on the interstate,24,traffic,128,1
how is the traffic on the way to the campsite,24,traffic,128,1
should i take a different route to work,24,traffic,128,1
"if i'm heading to the mall at 5:00, what will the traffic be like",24,traffic,128,1
how is the traffic at jfk at 5 pm on weekdays,24,traffic,128,1
i would like to know the traffic in tempe please,24,traffic,128,1
what's the traffic like on the way to the water slides,24,traffic,128,1
is there any traffic on the way to the bank,24,traffic,128,1
how bad is city traffic in miami on friday's at 5 pm,24,traffic,128,1
is the traffic bad on the way to work,24,traffic,128,1
can i initiate a one-time transfer from my savings account to my money market account,133,transfer,130,0
i want you to send ten dollars from bank of america to capital one,133,transfer,130,0
transfer two hundred dollars between my portfolio and my money market account,133,transfer,130,0
transfer $20000 from my savings account to checking account,133,transfer,130,0
help me move my money please,133,transfer,130,0
need to transfer from one account to my other one,133,transfer,130,0
i need $20000 transferred from my savings to my checking,133,transfer,130,0
i got to transfer ten dollars from my bank of america account to my capital one account,133,transfer,130,0
send 100 dollars from checking to savings,133,transfer,130,0
make a transfer between accounts,133,transfer,130,0
move 57 dollars from saving into mom,133,transfer,130,0
put $40 from account a to b,133,transfer,130,0
transfer money from this account to that account,133,transfer,130,0
i need you to send ten dollars from bank of america to capital one,133,transfer,130,0
move 100 dollars from checking to savings,133,transfer,130,0
i must transfer ten dollars from my bank of america account to my capital one account,133,transfer,130,0
transfer sixty dollars to dad from my biggest accnt,133,transfer,130,0
please transfer my funds,133,transfer,130,0
take $20000 from savings and put it in checking,133,transfer,130,0
take $40 from account a and transfer it to account b,133,transfer,130,0
translate english to french hello,61,translate,131,1
can you translate hello into swedish for me,61,translate,131,1
what is spanish for good morning,61,translate,131,1
can you translate milk into spanish for me,61,translate,131,1
how do they say hello in germany,61,translate,131,1
i wanna learn a phrase in russian,61,translate,131,1
can you translate bat into russian for me,61,translate,131,1
how would i say if i were english subway,61,translate,131,1
can you translate i have to go pee into korean for me,61,translate,131,1
what is the correct way to say 'i am a visitor' in french,61,translate,131,1
how can i say thank you in spanish,61,translate,131,1
what is the way to say thank you in spanish,61,translate,131,1
i would like to know how to say hello in french,61,translate,131,1
"i need you to translate the sentence, 'we will be there soon' into portuguese",61,translate,131,1
"how do they say ""what's up"" in chinese",61,translate,131,1
what phrase means goodbye in hawaii,61,translate,131,1
how could i say twin in chinese,61,translate,131,1
how would i say goodbye if i were norwegian,61,translate,131,1
how do you say thank you in german,61,translate,131,1
tell me how the russians say notebook,61,translate,131,1
can traveling to nepal be safe (what's safe in x),128,travel_alert,132,1
i am thinking of going to brazil and was wondering if that is hazardous,128,travel_alert,132,1
what are today's travel advisories,128,travel_alert,132,1
do i need to read any travel alerts for kenya,128,travel_alert,132,1
check travel alerts for kenya,128,travel_alert,132,1
does kenya have any travel alerts right now,128,travel_alert,132,1
is there a travel alert for that country,128,travel_alert,132,1
does finland have any travel alerts i should be aware of,128,travel_alert,132,1
i'd like to see if there's a travel alert for the country,128,travel_alert,132,1
are there any travel alerts for china,128,travel_alert,132,1
what are the currect travel alerts in africa,128,travel_alert,132,1
does japan have any travel alerts i should be aware of,128,travel_alert,132,1
does italy have any travel alerts i should be aware of,128,travel_alert,132,1
are there any travel alerts for syria,128,travel_alert,132,1
does france have any travel alerts i should be aware of,128,travel_alert,132,1
does argentina have a travel alert,128,travel_alert,132,1
have there been any travel alerts issued for france,128,travel_alert,132,1
what potential hazards are there for going to spain,128,travel_alert,132,1
look for travel alerts for china,128,travel_alert,132,1
i am going to australia and want to be notified of any travel alerts,128,travel_alert,132,1
tell my bank i'm going to france,146,travel_notification,133,0
tell my bank that i'm going to france,146,travel_notification,133,0
i need to let my bank know that i'll be travelling internationally,146,travel_notification,133,0
im going to be in paraguay from january 7th until january 10th,146,travel_notification,133,0
how can i let my bank know i'm going to denmark,146,travel_notification,133,0
i need to let my bank know i am traveling to new york,146,travel_notification,133,0
im going to be in canada from august 10th until august 12th,146,travel_notification,133,0
i'm going out of the country and need to notify my bank,146,travel_notification,133,0
i'm travelling to boston soon and want to inform my bank,146,travel_notification,133,0
tell my bank i will be travelling to the caribbean,146,travel_notification,133,0
notify my bank that i will be in rome from february 1 to march 1,146,travel_notification,133,0
i'm traveling between denver and la so tell my bank,146,travel_notification,133,0
alert my bank and let them know that i'm travelling to brussels,146,travel_notification,133,0
tell my bank that i'll be in canada this weekend,146,travel_notification,133,0
the bank should know i am going to asia soon,146,travel_notification,133,0
"i'll be out of the country soon, and want to notify my bank",146,travel_notification,133,0
please let my bank know that i will be in rome from february 1 to march 1,146,travel_notification,133,0
alert my bank and tell them that i'm travelling to paris,146,travel_notification,133,0
i'm going to be in thailand from october 15th until october 23rd,146,travel_notification,133,0
i need to let my bank know i am traveling to la,146,travel_notification,133,0
what's the funnest thing for a tourist to do in iceland,149,travel_suggestion,134,0
